Sheet: Calendar
C2: <- Enter year to view | G2: of:=INDEX(MonthsTable;7*(ROW()-Row0)+(COLUMN()-Column0)+7-WeekDayJan1;1+IsLeapYear) -> JAN|31 | H2: of:=INDEX(MonthsTable;7*(ROW()-Row0)+(COLUMN()-Column0)+7-WeekDayJan1;1+IsLeapYear) -> • | I2: of:=INDEX(MonthsTable;7*(ROW()-Row0)+(COLUMN()-Column0)+7-WeekDayJan1;1+IsLeapYear) -> • | J2: of:=INDEX(MonthsTable;7*(ROW()-Row0)+(COLUMN()-Column0)+7-WeekDayJan1;1+IsLeapYear) -> FEB|28; MAR|31 | K2: of:=INDEX(MonthsTable;7*(ROW()-Row0)+(COLUMN()-Column0)+7-WeekDayJan1;1+IsLeapYear) -> • | L2: of:=INDEX(MonthsTable;7*(ROW()-Row0)+(COLUMN()-Column0)+7-WeekDayJan1;1+IsLeapYear) -> • | M2: of:=INDEX(MonthsTable;7*(ROW()-Row0)+(COLUMN()-Column0)+7-WeekDayJan1;1+IsLeapYear) -> APR|30
G3: of:=INDEX(MonthsTable;7*(ROW()-Row0)+(COLUMN()-Column0)+7-WeekDayJan1;1+IsLeapYear) -> • | H3: of:=INDEX(MonthsTable;7*(ROW()-Row0)+(COLUMN()-Column0)+7-WeekDayJan1;1+IsLeapYear) -> MAY|31 | I3: of:=INDEX(MonthsTable;7*(ROW()-Row0)+(COLUMN()-Column0)+7-WeekDayJan1;1+IsLeapYear) -> • | J3: of:=INDEX(MonthsTable;7*(ROW()-Row0)+(COLUMN()-Column0)+7-WeekDayJan1;1+IsLeapYear) -> • | K3: of:=INDEX(MonthsTable;7*(ROW()-Row0)+(COLUMN()-Column0)+7-WeekDayJan1;1+IsLeapYear) -> JUN|30 | L3: of:=INDEX(MonthsTable;7*(ROW()-Row0)+(COLUMN()-Column0)+7-WeekDayJan1;1+IsLeapYear) -> • | M3: of:=INDEX(MonthsTable;7*(ROW()-Row0)+(COLUMN()-Column0)+7-WeekDayJan1;1+IsLeapYear) -> JUL|31
B4: of:=YEAR(TODAY()) -> 2023 | C4: <- Current Year | G4: of:=INDEX(MonthsTable;7*(ROW()-Row0)+(COLUMN()-Column0)+7-WeekDayJan1;1+IsLeapYear) -> • | H4: of:=INDEX(MonthsTable;7*(ROW()-Row0)+(COLUMN()-Column0)+7-WeekDayJan1;1+IsLeapYear) -> • | I4: of:=INDEX(MonthsTable;7*(ROW()-Row0)+(COLUMN()-Column0)+7-WeekDayJan1;1+IsLeapYear) -> AUG|31 | J4: of:=INDEX(MonthsTable;7*(ROW()-Row0)+(COLUMN()-Column0)+7-WeekDayJan1;1+IsLeapYear) -> • | K4: of:=INDEX(MonthsTable;7*(ROW()-Row0)+(COLUMN()-Column0)+7-WeekDayJan1;1+IsLeapYear) -> • | L4: of:=INDEX(MonthsTable;7*(ROW()-Row0)+(COLUMN()-Column0)+7-WeekDayJan1;1+IsLeapYear) -> SEP|30 | M4: of:=INDEX(MonthsTable;7*(ROW()-Row0)+(COLUMN()-Column0)+7-WeekDayJan1;1+IsLeapYear) -> •
G5: of:=INDEX(MonthsTable;7*(ROW()-Row0)+(COLUMN()-Column0)+7-WeekDayJan1;1+IsLeapYear) -> OCT|31 | H5: of:=INDEX(MonthsTable;7*(ROW()-Row0)+(COLUMN()-Column0)+7-WeekDayJan1;1+IsLeapYear) -> • | I5: of:=INDEX(MonthsTable;7*(ROW()-Row0)+(COLUMN()-Column0)+7-WeekDayJan1;1+IsLeapYear) -> • | J5: of:=INDEX(MonthsTable;7*(ROW()-Row0)+(COLUMN()-Column0)+7-WeekDayJan1;1+IsLeapYear) -> NOV|30 | K5: of:=INDEX(MonthsTable;7*(ROW()-Row0)+(COLUMN()-Column0)+7-WeekDayJan1;1+IsLeapYear) -> • | L5: of:=INDEX(MonthsTable;7*(ROW()-Row0)+(COLUMN()-Column0)+7-WeekDayJan1;1+IsLeapYear) -> DEC|31 | M5: of:=INDEX(MonthsTable;7*(ROW()-Row0)+(COLUMN()-Column0)+7-WeekDayJan1;1+IsLeapYear) -> •
G6: of:=INDEX(MonthsTable;7*(ROW()-Row0)+(COLUMN()-Column0)+7-WeekDayJan1;1+IsLeapYear) -> • | H6: of:=INDEX(MonthsTable;7*(ROW()-Row0)+(COLUMN()-Column0)+7-WeekDayJan1;1+IsLeapYear) -> • | I6: of:=INDEX(MonthsTable;7*(ROW()-Row0)+(COLUMN()-Column0)+7-WeekDayJan1;1+IsLeapYear) -> • | J6: of:=INDEX(MonthsTable;7*(ROW()-Row0)+(COLUMN()-Column0)+7-WeekDayJan1;1+IsLeapYear) -> • | K6: of:=INDEX(MonthsTable;7*(ROW()-Row0)+(COLUMN()-Column0)+7-WeekDayJan1;1+IsLeapYear) -> • | L6: of:=INDEX(MonthsTable;7*(ROW()-Row0)+(COLUMN()-Column0)+7-WeekDayJan1;1+IsLeapYear) -> • | M6: of:=INDEX(MonthsTable;7*(ROW()-Row0)+(COLUMN()-Column0)+7-WeekDayJan1;1+IsLeapYear) -> •
B7: 1 | C7: of:=[.B7]+7 -> 8 | D7: of:=[.C7]+7 -> 15 | E7: of:=[.D7]+7 -> 22 | F7: of:=[.E7]+7 -> 29 | G7: SUN | H7: MON | I7: TUE | J7: WED | K7: THU | L7: FRI | M7: SAT
B8: of:=[.B7]+1 -> 2 | C8: of:=[.B8]+7 -> 9 | D8: of:=[.C8]+7 -> 16 | E8: of:=[.D8]+7 -> 23 | F8: of:=[.E8]+7 -> 30 | G8: MON | H8: TUE | I8: WED | J8: THU | K8: FRI | L8: SAT | M8: SUN
B9: of:=[.B8]+1 -> 3 | C9: of:=[.B9]+7 -> 10 | D9: of:=[.C9]+7 -> 17 | E9: of:=[.D9]+7 -> 24 | F9: of:=[.E9]+7 -> 31 | G9: TUE | H9: WED | I9: THU | J9: FRI | K9: SAT | L9: SUN | M9: MON
B10: of:=[.B9]+1 -> 4 | C10: of:=[.B10]+7 -> 11 | D10: of:=[.C10]+7 -> 18 | E10: of:=[.D10]+7 -> 25 | G10: WED | H10: THU | I10: FRI | J10: SAT | K10: SUN | L10: MON | M10: TUE
B11: of:=[.B10]+1 -> 5 | C11: of:=[.B11]+7 -> 12 | D11: of:=[.C11]+7 -> 19 | E11: of:=[.D11]+7 -> 26 | G11: THU | H11: FRI | I11: SAT | J11: SUN | K11: MON | L11: TUE | M11: WED
B12: of:=[.B11]+1 -> 6 | C12: of:=[.B12]+7 -> 13 | D12: of:=[.C12]+7 -> 20 | E12: of:=[.D12]+7 -> 27 | G12: FRI | H12: SAT | I12: SUN | J12: MON | K12: TUE | L12: WED | M12: THU
B13: of:=[.B12]+1 -> 7 | C13: of:=[.B13]+7 -> 14 | D13: of:=[.C13]+7 -> 21 | E13: of:=[.D13]+7 -> 28 | G13: SAT | H13: SUN | I13: MON | J13: TUE | K13: WED | L13: THU | M13: FRI
B16: This one-page calendar will change how you view the year by Ethan Siegel
B17: https://medium.com/starts-with-a-bang/this-one-page-calendar-will-change-how-you-view-the-year-b8ecad85eebd
B19: CalendarYear Calc/Excel spreadsheet by Kevin Wu
B21: The 3-Clause BSD License
B22: Copyright © 2023 Kevin Wu
B23: Redistribution and use in source and binary forms, with or without modification, are permitted provided that the following conditions are met:
B24: 1. Redistributions of source code must retain the above copyright notice, this list of conditions and the following disclaimer.
B25: 2. Redistributions in binary form must reproduce the above copyright notice, this list of conditions and the following disclaimer in the documentation and/or other materials provided with the distribution.
B26: 3. Neither the name of the copyright holder nor the names of its contributors may be used to endorse or promote products derived from this software without specific prior written permission.
B27: THIS SOFTWARE IS PROVIDED BY THE COPYRIGHT HOLDERS AND CONTRIBUTORS "AS IS" AND ANY EXPRESS OR IMPLIED WARRANTIES, INCLUDING, BUT NOT LIMITED TO, THE IMPLIED WARRANTIES OF MERCHANTABILITY AND FITNESS FOR A PARTICULAR PURPOSE ARE DISCLAIMED. IN NO EVENT SHALL THE COPYRIGHT HOLDER OR CONTRIBUTORS BE LIABLE FOR ANY DIRECT, INDIRECT, INCIDENTAL, SPECIAL, EXEMPLARY, OR CONSEQUENTIAL DAMAGES (INCLUDING, BUT NOT LIMITED TO, PROCUREMENT OF SUBSTITUTE GOODS OR SERVICES; LOSS OF USE, DATA, OR PROFITS; OR BUSINESS INTERRUPTION) HOWEVER CAUSED AND ON ANY THEORY OF LIABILITY, WHETHER IN CONTRACT, STRICT LIABILITY, OR TORT (INCLUDING NEGLIGENCE OR OTHERWISE) ARISING IN ANY WAY OUT OF THE USE OF THIS SOFTWARE, EVEN IF ADVISED OF THE POSSIBILITY OF SUCH DAMAGE.

Sheet: Helper
A1: Regular Year Months | B1: Leap Year Months | C1: View Year | D1: Is the view year a leap year? | E1: Previous Year | F1: Day of the week of January 1 | G1: Upper Left Column | H1: Upper Left Row
A2: • | B2: • | C2: of:=IF(InputYear<>0;InputYear;CurrentYear) -> 2023 | D2: of:=IF(MOD(ViewYear;400)=0;1;IF(AND(MOD(ViewYear;4)=0;MOD(ViewYear;100)<>0);1;0)) -> 0 | E2: of:=ViewYear-1 -> 2022 | F2: of:=MOD(PrevYear+QUOTIENT(PrevYear;4)-QUOTIENT(PrevYear;100)+QUOTIENT(PrevYear;400)+1;7) -> 0 | G2: of:=COLUMN([$Calendar.G2]) -> 7 | H2: of:=ROW([$Calendar.G2]) -> 2
A3: • | B3: •
A4: • | B4: •
A5: • | B5: •
A6: • | B6: •
A7: • | B7: •
A8: JAN|31 | B8: JAN|31
A9: • | B9: •
A10: • | B10: •
A11: FEB|28; MAR|31 | B11: FEB|29
A12: • | B12: MAR|31
A13: • | B13: •
A14: APR|30 | B14: •
A15: • | B15: APR|30
A16: MAY|31 | B16: •
A17: • | B17: MAY|31
A18: • | B18: •
A19: JUN|30 | B19: •
A20: • | B20: JUN|30
A21: JUL|31 | B21: •
A22: • | B22: JUL|31
A23: • | B23: •
A24: AUG|31 | B24: •
A25: • | B25: AUG|31
A26: • | B26: •
A27: SEP|30 | B27: •
A28: • | B28: SEP|30
A29: OCT|31 | B29: •
A30: • | B30: OCT|31
A31: • | B31: •
A32: NOV|30 | B32: •
A33: • | B33: NOV|30
A34: DEC|31 | B34: •
A35: • | B35: DEC|31
A36: • | B36: •
A37: • | B37: •
A38: • | B38: •
A39: • | B39: •
A40: • | B40: •
A41: • | B41: •
A42: • | B42: •
A43: • | B43: •
A44: • | B44: •